"en_décembre_2025,_l’indice_national_des_prix_à_la_consommation_a_progressé_de_0,8%_par_rapport_au_mois",scraped_at
précédent. Cette évolution mensuelle s’explique par la hausse des prix observée dans l’ensemble des,2026-01-19 12:15:01
fonctions de consommation. Les principales contributions à cette progression proviennent notamment,2026-01-19 12:15:01
"des « produits alimentaires et boissons non alcoolisées » (+1,2%), du « logement, eau, gaz, électricité et",2026-01-19 12:15:01
"autres combustibles » (+0,2%) et de la « communication » (+0,4%).",2026-01-19 12:15:01
Le taux d’inflation sur les douze derniers mois a enregistré une hausse en décembre 2025 pour s’établir à,2026-01-19 12:15:01
"1,6%. En glissement annuel, il atteint 4,1%.",2026-01-19 12:15:01
